body_type,additional_features,dress_type,sleeve_type,necklace,bracelet,earrings,dress_design,accessory_design
Hourglass,busted,party wear,mid length,v shape,stacks,jhumka,Suitable for hourglass and party wear with mid length sleeves :,"Suitable for v shape necklace, stacks bracelet, and jhumka earrings"
Pear-shaped,optional,party wear,sleeveless,v shape,bangles,jhumka,A-line design with a deep v neckline,Chandelier earrings and bangles
Hourglass,busted,party wear,short length,choker,stacks,jhumka,Bust Darts,Wear a choker with shoulder-duster earrings and a pair of stacks.
Inverted triangle,optional,party wear,puffy shoulder,v shape,bangles,studs,"half sleeve, v neck, no pleats, front slit, back slit",simple
Rectangle,busted,crop top,puffy shoulder,choker,bangles,drop earrings,Leopard Print,Golden
Rectangle,optional,party wear,full length,rounded,charms,drop earrings,Tiered dress,Modern and trendy
Pear-shaped,optional,t shirt,mid length,rounded,stacks,studs,Full sleeve asymmetric shirt dress,Bright beaded choker and delicate stud earrings
Apple-shaped,optional,party wear,short length,choker,stacks,drop earrings,Deep-V neckline,Small dangling earrings
Inverted triangle,broad shoulders,kurti,full length,choker,bangles,studs,dress design with draping at the front,"necklace with a pendant, bracelet with a chain, and earrings with a stud design"
Apple-shaped,busted,party wear,short length,rounded,bangles,drop earrings,long length with v neckline,simple
Hourglass,busted,party wear,short length,rounded,bangles,jhumka,Fitted bodice,Dainty
Inverted triangle,busted,party wear,short length,choker,stacks,drop earrings,Cold shoulder dress design,Classy
Apple-shaped,busted,t shirt,mid length,choker,stacks,drop earrings,A-line,Minimalist
Inverted triangle,optional,party wear,sleeveless,rounded,stacks,studs,Straight cut mini dress with round neckline,Red gems in a row
Pear-shaped,optional,party wear,short length,rounded,stacks,drop earrings,cold shoulder,Mismatched jewelry
Pear-shaped,optional,party wear,short length,rounded,stacks,jhumka,A-line dress with cap sleeves,Bold and sassy
Hourglass,optional,crop top,sleeveless,rounded,bangles,drop earrings,Ruffled neckline with deep-V cut at front and back,Casual
Apple-shaped,busted,party wear,puffy shoulder,rounded,charms,studs,"High neckline, straight hem, back slit","Short scattered earrings, bracelet: long, thin, semi-circular"
Apple-shaped,broad shoulders,party wear,sleeveless,choker,stacks,jhumka,Empire waist dress,Glittery
Pear-shaped,broad shoulders,t shirt,full length,rounded,bangles,studs,tulip,Classic with pearl chain
Pear-shaped,busted,party wear,mid length,v shape,stacks,drop earrings,Fitted with mid length sleeves,Golden and silver jewelry
Pear-shaped,optional,party wear,short length,rounded,stacks,drop earrings,A-line dress,matching
Inverted triangle,broad shoulders,party wear,full length,rounded,bangles,jhumka,Ombre with high collar and fluted sleeves,Jhumka with pearl earrings and bangles
Apple-shaped,busted,party wear,short length,v shape,charms,studs,Fitted Knee Length Party Wear Dress With Short Length Sleeves,"Pearl, gold, and rhinestone necklace, bracelet, and earrings"
Rectangle,optional,party wear,mid length,rounded,stacks,drop earrings,"Long sleeve, fitted top, gathered skirt",Semi precious stones
Rectangle,busted,party wear,short length,rounded,charms,jhumka,Square neckline with pleats,Casual
Pear-shaped,optional,party wear,short length,rounded,stacks,jhumka,Tiered dress with a plunging neckline,Elegant and graceful
Hourglass,optional,party wear,short length,v shape,charms,studs,Bodycon,Floral designs
Pear-shaped,broad shoulders,party wear,mid length,v shape,bangles,jhumka,slit on both sides,"Gold necklace, bracelet, and earrings"
Apple-shaped,busted,party wear,mid length,choker,bangles,studs,A-line style,Chick style
Inverted triangle,busted,t shirt,mid length,rounded,bangles,studs,Double pleated mid length sleeves,Elegant
Apple-shaped,broad shoulders,party wear,full length,rounded,stacks,studs,boat neckline,Studs
Apple-shaped,optional,party wear,short length,choker,bangles,drop earrings,Straight collar neckline,Contemporary
Inverted triangle,optional,party wear,mid length,choker,stacks,drop earrings,"Suitable dress design for above body type, dress type, and sleeve type is one shoulder dress","Suitable accessory design for above necklace, bracelet, and earrings is one statement necklace, stacked bracelets, and drop earrings"
Pear-shaped,optional,t shirt,full length,rounded,charms,jhumka,Gathered design with a round neck,Attractive hoops with a chain
Pear-shaped,broad shoulders,party wear,full length,rounded,charms,jhumka,"chiffon, floral",simple
Pear-shaped,optional,party wear,sleeveless,choker,bangles,drop earrings,Short cocktail dresses with dramatic necklines and sleeveless designs.,"The accessory design should be minimalistic and complement the necklace, bracelet, and earrings. Think about a pair of statement earrings or a simple necklace that can be dressed up with the right bracelet."
Pear-shaped,busted,crop top,sleeveless,choker,stacks,drop earrings,A-line,Gothic
Pear-shaped,optional,kurti,mid length,choker,bangles,jhumka,Checkered print,Half-sleeved Kurti
Hourglass,busted,t shirt,full length,choker,bangles,drop earrings,Straight dress with A-line sleeves,Gold jewelry with shells
Inverted triangle,optional,t shirt,short length,choker,charms,drop earrings,button front,Mismatched
Rectangle,broad shoulders,party wear,one shouldered,choker,charms,studs,A-line dress,"Wear a gold choker necklace, gold bracelet, and gold stud earrings"
Rectangle,optional,crop top,sleeveless,choker,stacks,jhumka,tube top,matching set
Apple-shaped,optional,kurti,full length,v shape,charms,studs,"Crafted with elegance and grace, the sleeveless dress design is a captivating choice for those seeking an effortless and stylish look. Its sleeveless silhouette showcases your shoulders and arms, adding an air of sophistication to your ensemble.","Adorn your neck with a delicate pendant necklace, while the bracelet accentuates your wrist with a bangle or a stylish cuff. Earrings complete the look with a pair of studs or hoops, adding a charming touch to your ensemble."
Hourglass,broad shoulders,kurti,short length,rounded,charms,drop earrings,Crop top,Bold necklace with charms bracelet and drop earrings
Pear-shaped,busted,t shirt,mid length,rounded,stacks,studs,"body-hugging, with a low neckline and long sleeves",simple
Hourglass,optional,kurti,sleeveless,rounded,stacks,jhumka,Straight,Necklace: chunky; Bracelet: cuff; Earrings: studs
Inverted triangle,busted,kurti,sleeveless,rounded,bangles,jhumka,Contrast Pocket,Glass bangles with jhumka
Hourglass,optional,kurti,short length,rounded,stacks,studs,simple designed kurti,simple design
Pear-shaped,busted,kurti,short length,rounded,stacks,drop earrings,Dress designed to give a flattering look to the body type with a V-neckline and a short sleeve length,"A minimalist accessory design with a single necklace, bracelet, and earrings"
Hourglass,optional,t shirt,short length,rounded,bangles,jhumka,"V neckline, boat neckline, crew neckline, scoop neckline, square neckline, halter neckline","Simple, formal, and simple"
Pear-shaped,optional,party wear,puffy shoulder,choker,bangles,jhumka,"Sweetheart neckline, puffy shoulder sleeves, and a long hemline","Long, dangling earrings with a classic choker necklace and bangles"
Rectangle,optional,party wear,short length,v shape,charms,studs,straight,Golden
Rectangle,busted,t shirt,short length,choker,stacks,studs,Empire waist,metallic and minimalist
Pear-shaped,busted,party wear,short length,choker,bangles,drop earrings,Body-con dress style with full sleeve,golden necklace and golden earrings with golden bangles
Pear-shaped,optional,party wear,one shouldered,v shape,stacks,studs,cold shoulder,Dress up your pear-shaped figure with glamourous pieces and bold colors
Hourglass,broad shoulders,party wear,short length,choker,bangles,studs,crop top and maxi skirt,multi-colour
Rectangle,busted,party wear,mid length,v shape,stacks,drop earrings,Curvy,"bracelet-gold bangle, earrings-huge hoops and necklace-statement necklace"
Rectangle,busted,kurti,sleeveless,v shape,charms,drop earrings,Feminine Design,Modern Design
Pear-shaped,optional,kurti,short length,rounded,bangles,jhumka,crop top,Simple and classy
Apple-shaped,optional,t shirt,short length,rounded,bangles,drop earrings,Straight or slight flare design,Simple
Hourglass,broad shoulders,kurti,sleeveless,rounded,stacks,drop earrings,"This dress is suitable for a Hourglass body type, it is a kurti and has sleeveless sleeves. It would look best with a rounded necklace, stacks of bracelets, and drop earrings.","This accessory design is suitable for a rounded necklace, stacks of bracelets, and drop earrings"
Pear-shaped,optional,party wear,short length,rounded,bangles,drop earrings,Off shoulder style,"Suitable accessory design for the given necklace, bracelet, and earrings is simple and elegant."
Pear-shaped,busted,t shirt,sleeveless,rounded,stacks,jhumka,Round neckline t shirt with boat neckline,Beautiful
Hourglass,optional,party wear,short length,v shape,bangles,studs,Low neckline,Family of earrings
Apple-shaped,busted,t shirt,mid length,rounded,charms,drop earrings,straight,multi-coloured
Pear-shaped,busted,kurti,full length,v shape,bangles,studs,Crop top with a deep V-neckline and a tie-up waist,A casual accessory design with a chain and a pendant
Rectangle,optional,t shirt,mid length,choker,stacks,studs,"Gathered, knee length, pearl necklace, studs",Stacks
Hourglass,busted,crop top,sleeveless,rounded,stacks,studs,Fitted with an empire waist and a scoop neckline,dangling earrings
Inverted triangle,busted,party wear,full length,choker,charms,studs,Short sleeves with high waist and round neckline,Chains and charms
Pear-shaped,optional,t shirt,full length,rounded,stacks,jhumka,"Dress Designs For Pear-Shaped Body Type, T Shirt, with Full-Length Sleeve","Accessory Designs For Rounded Necklace, Stacks Bracelet, and Jhumka Earrings"
Rectangle,optional,t shirt,one shouldered,choker,stacks,studs,t shirt dress with one shoulder,"Classic, Stacks"
Rectangle,optional,kurti,short length,choker,stacks,jhumka,Straight line dress design,Just regular earrings
Pear-shaped,busted,party wear,mid length,rounded,stacks,drop earrings,tight fitting,"statement necklace, cuff bracelets, and stud earrings"
Apple-shaped,optional,crop top,short length,rounded,bangles,studs,Narrow sleeves,Small and simple
Pear-shaped,busted,party wear,full length,v shape,charms,studs,"Suitable for body type: Pear-shaped, dress type: party wear, sleeve type: full length","Suitable for necklace: v shape, bracelet: charms, earrings: studs"
Hourglass,optional,party wear,puffy shoulder,rounded,charms,jhumka,A-line,cute
Hourglass,busted,party wear,sleeveless,choker,stacks,jhumka,Wear a clingy spaghetti strap dress for a fashionable outlook.,"Wear a stacked necklace with a choker, stacked bracelets, and jhumka earrings for a statement look."
Hourglass,optional,crop top,sleeveless,v shape,stacks,studs,V-neckline,"Studs, stacks and v-shape necklace"
Apple-shaped,optional,party wear,mid length,rounded,stacks,jhumka,a-line,minimal boho
Apple-shaped,busted,t shirt,mid length,v shape,stacks,jhumka,camisole top,"strand of pearls, gold chain with pendant, drop earrings"
Pear-shaped,busted,kurti,full length,rounded,stacks,studs,Sleeveless dress,Vintage rings
Hourglass,optional,t shirt,full length,rounded,charms,jhumka,Sweetheart Neckline Dress,Mismatched
Apple-shaped,busted,t shirt,sleeveless,rounded,stacks,drop earrings,Bodycon,minimalism
Inverted triangle,broad shoulders,party wear,puffy shoulder,rounded,stacks,studs,Cold shoulder or off-shoulder dress,simple
Hourglass,optional,party wear,mid length,v shape,stacks,drop earrings,Asymmetric,Let your earrings take the limelight
Hourglass,busted,party wear,sleeveless,v shape,charms,jhumka,Kurtis with slim fit,Modern
Pear-shaped,optional,t shirt,full length,rounded,bangles,studs,Bodycon,simple
Inverted triangle,optional,t shirt,sleeveless,choker,stacks,studs,Shoulder baring,bold statement
Pear-shaped,broad shoulders,party wear,short length,v shape,charms,jhumka,Gathered sleeve,"large hoops, charms and pendants"
Pear-shaped,optional,party wear,puffy shoulder,rounded,bangles,studs,"With a sleeve type of puffy shoulder, a dress design that would suit a pear-shaped body type with a dress type of party wear would be a dress with a skirt that is fitted or flared at the bottom, with a top that is loose-fitting and has a v-neck or scoop","With a necklace design of rounded, a bracelet design of bangles, and an earring design of studs, a suitable accessory design for a pear-shaped body type with a dress type of party wear and a sleeve type of puffy shoulder would be a pair of high heels and a clutch"
Pear-shaped,optional,party wear,puffy shoulder,rounded,stacks,drop earrings,Balanced,Low Key
Apple-shaped,busted,kurti,sleeveless,rounded,stacks,jhumka,"The dress design suitable for the given body type, dress type, and sleeve type is a fitted, brightly colored kurti with a round neckline and sleeveless sleeves. It can be paired with a statement necklace, stacked bracelets, and jhumka earrings for an eye-","The accessory design suitable for the given necklace, bracelet, and earrings is a mix of traditional and modern styles. A rounded, statement necklace can be paired with stacked bracelets that have intricate details and jhumka earrings that add a touch of glamour. The necklace"
Inverted triangle,broad shoulders,party wear,short length,choker,stacks,studs,Straight line,Modern
Pear-shaped,optional,party wear,short length,v shape,bangles,drop earrings,high neckline with short sleeves,"drop earrings, bangles, v shape"
Hourglass,broad shoulders,t shirt,full length,choker,stacks,drop earrings,"sweetheart neck, flare sleeves and side slit",subtle
Pear-shaped,busted,party wear,puffy shoulder,rounded,charms,drop earrings,"This dress is suitable for pear-shaped bodies. It is a party wear dress and has puffy shoulder sleeves. It is decorated with chain earrings, a bib necklace, and a chain bracelet.","The accessory design includes a bracelet with chain links, a necklace with a chain, and drop earrings."
Pear-shaped,broad shoulders,kurti,short length,rounded,stacks,studs,More fuller sleeves that will help you to look slimmer,"Earrings: studs, bracelet: stacks, necklace: rounded"
Apple-shaped,busted,t shirt,short length,rounded,stacks,drop earrings,Straight dress design,Simple and plain
Inverted triangle,optional,kurti,full length,rounded,bangles,studs,"Kurti with V-neckline, flared kurta with front slit and embroidery, kurti with front slit with lace trimming, kurti with front slit with lace trimming and embroidery, kurti with front slit with l","Rounded, bangles, studs"
Hourglass,busted,party wear,one shouldered,rounded,stacks,jhumka,Spaghetti strap dress,Semi-precious stone jewelry
Pear-shaped,optional,kurti,sleeveless,v shape,stacks,drop earrings,Straight cut,"Earrings: drop earrings, Necklace: v shape, Bracelet: stacks"
Pear-shaped,broad shoulders,t shirt,puffy shoulder,v shape,bangles,jhumka,Straight cut shirt with a v-neckline,Modern design
Hourglass,optional,kurti,short length,rounded,bangles,jhumka,"The dress design suitable for the given body type, dress type, and sleeve type is a kurti with short length sleeves, rounded neckline, and bangles, jhumka, and bangles as accessories.","The accessory design suitable for the given necklace, bracelet, and earrings is a combination of rounded necklace, bangles, and jhumka."
Apple-shaped,busted,party wear,puffy shoulder,v shape,bangles,drop earrings,"Asymmetrical sleeve, off shoulder",Satin bow
Hourglass,broad shoulders,party wear,full length,rounded,stacks,drop earrings,A dress with a deep v-neckline and a fitted waistline would look great on you.,A simple diamond necklace with a classic design and a pair of simple stud earrings would look great with your outfit.
Apple-shaped,broad shoulders,t shirt,mid length,choker,stacks,studs,"The dress design suitable for the given body type, dress type, and sleeve type is a mid-length sleeve t-shirt dress with a choker necklace, stacks of bracelets, and stud earrings.","The accessory design suitable for the given necklace, bracelet, and earrings is a choker necklace, stacked bracelets, and stud earrings."
Apple-shaped,busted,crop top,puffy shoulder,choker,stacks,drop earrings,Straight skirt,Balanced accessory design
Rectangle,optional,party wear,short length,choker,charms,drop earrings,sleeveless,"necklace: choker, bracelet: charms, earrings: drop earrings"
Apple-shaped,busted,kurti,puffy shoulder,choker,bangles,jhumka,round neck,Classic
Pear-shaped,optional,t shirt,sleeveless,choker,stacks,drop earrings,long cardigan,Bold accessories
Pear-shaped,busted,t shirt,full length,rounded,stacks,jhumka,Casual,Fun
Hourglass,busted,t shirt,full length,choker,bangles,drop earrings,Solid top with button detailing,"Long necklace, bangles, drop earrings"
Pear-shaped,optional,party wear,one shouldered,rounded,stacks,drop earrings,Fitted design,chic and casual
Hourglass,optional,t shirt,short length,choker,bangles,drop earrings,Wrap dress,Vintage style
Apple-shaped,busted,t shirt,sleeveless,rounded,bangles,jhumka,Pleated,Fashionable
Rectangle,busted,t shirt,short length,choker,charms,studs,Body hugging,Simple
Pear-shaped,optional,kurti,mid length,rounded,stacks,drop earrings,kurti with v-neckline,"rounded earrings, stacked bracelets, and drop earrings"
Pear-shaped,busted,t shirt,full length,rounded,stacks,drop earrings,"tight knit top with a round neck and a high neckline, a full-length sleeve, and a round neckline","gold hoops, gold bangles, gold rings"
Apple-shaped,busted,party wear,full length,v shape,stacks,jhumka,Elegant,"Hoop earrings, choker necklace, and stacked bracelets"
Rectangle,optional,party wear,sleeveless,v shape,stacks,jhumka,Bell sleeves,Bracelet: Tennis Bracelet
Pear-shaped,busted,party wear,short length,choker,stacks,drop earrings,"plain neckline, knee length, balloon sleeves, high waist, A-line","Plain neckline, knee length, balloon sleeves, high waist, A-line, bracelet: stacks, earrings: drop earrings"
Pear-shaped,busted,kurti,full length,rounded,bangles,studs,Bohemian,Bohemian
Pear-shaped,busted,t shirt,short length,v shape,bangles,studs,"Suitable dress design for pear shaped body type, t shirt dress, and short length sleeve would be a knee length straight cut black dress with white polka dots.","Suitable accessory design for v shape necklace, bangles, and studs would be a pair of wide pendants in black and gold color."
Hourglass,busted,crop top,sleeveless,v shape,bangles,studs,A-line,Modern
Apple-shaped,optional,party wear,mid length,v shape,stacks,studs,Fitted dress with mid-length sleeves and a V-neckline,golden bracelet with stud earrings and v shape necklace
Rectangle,broad shoulders,party wear,one shouldered,v shape,bangles,drop earrings,Sweetheart neckline with one shoulder,Classic
Pear-shaped,broad shoulders,kurti,puffy shoulder,choker,bangles,jhumka,"With its puffy shoulder sleeves and broad shoulders, this kurti perfectly complements the pear-shaped body type. Pair it with a choker necklace, bangles, and jhumka earrings to create a complete look.","The accessory design should be a minimalist approach with geometric shapes and bold lines. Consider incorporating a choker necklace, bangles, and jhumka earrings with a modern and sleek design."
Rectangle,busted,party wear,puffy shoulder,choker,stacks,studs,Printed floral dress,Choker necklace with stack bracelet and studs earring
Pear-shaped,broad shoulders,kurti,mid length,choker,charms,studs,"the dress design is a trendy and comfortable style that is suitable for all occasions, from casual outings to formal events.","The accessory design is a stylish and versatile combination that can be worn with a variety of outfits. The choker necklace adds a touch of sophistication and elegance, while the charms bracelet and stud earrings offer a playful and fun touch. This combination is perfect for a night"
Hourglass,busted,crop top,short length,v shape,bangles,jhumka,Bodycon Dress,"Polki Jhumka, Bangle and V Shape Necklace"
Apple-shaped,busted,kurti,puffy shoulder,rounded,bangles,jhumka,design 3,gold coin earrings and gold anklets
Hourglass,busted,kurti,puffy shoulder,choker,bangles,studs,This kurti is designed in such a way that it enhances your body type and provides a perfect fit. The puffy shoulder sleeve adds the right amount of volume and makes you look stylish. The choker necklace adds a touch of glamour to your outfit.,"The choker necklace, bangles bracelet, and stud earrings create a perfect balance with each other."
Pear-shaped,broad shoulders,party wear,sleeveless,rounded,bangles,jhumka,"High necked, belted","Earrings: jhumka, bracelet: bangles, necklace: rounded"
Rectangle,busted,kurti,one shouldered,rounded,bangles,jhumka,Semi-formal,Chic
Hourglass,optional,party wear,short length,choker,charms,drop earrings,A-line silhouette,Hoop earrings with pearl studs
Pear-shaped,optional,kurti,mid length,rounded,bangles,jhumka,Fitted Style,Modern
Hourglass,busted,crop top,short length,v shape,stacks,drop earrings,minimal,modern
Pear-shaped,busted,party wear,one shouldered,choker,bangles,drop earrings,Sweetheart neckline,Mismatched bracelets with bangles and drop earrings
Pear-shaped,optional,party wear,sleeveless,v shape,stacks,jhumka,Sweetheart neckline with a side slit,"Necklace - V shape, Bracelet - Stacks, Earrings - Jhumka"
Apple-shaped,busted,kurti,short length,choker,bangles,jhumka,V-neck kurti,"Simple choker, bangles, and jhumka"
Rectangle,busted,party wear,puffy shoulder,rounded,bangles,jhumka,Fitted,Leather
Hourglass,optional,kurti,short length,rounded,bangles,studs,Solid body with short length sleeves,Simple
Inverted triangle,optional,party wear,short length,rounded,bangles,studs,Bell sleeves,Pearls and diamonds
Rectangle,optional,t shirt,short length,choker,stacks,studs,Sleeveless,"Necklace: Choker, Bracelet: Stacks, Earrings: Studs"
Apple-shaped,busted,party wear,full length,v shape,bangles,studs,Straight dress design,A combination of minimalistic and fun accessories
Rectangle,optional,kurti,full length,choker,stacks,studs,Straight bottom kurti with full length sleeves,Rings and chokers
Pear-shaped,broad shoulders,t shirt,full length,v shape,stacks,jhumka,Floral print,Peacock
Pear-shaped,busted,t shirt,short length,v shape,charms,studs,Tshirt dress with short sleeve,simple
Hourglass,optional,crop top,short length,choker,stacks,studs,Bell sleeves,"reddish brown earrings, hoops, and choker"
Apple-shaped,broad shoulders,party wear,short length,v shape,charms,drop earrings,"Dress design with a v-neckline, a loose fit, and a short length",A delicate choker with drop earrings and a charm bracelet
Pear-shaped,broad shoulders,party wear,full length,choker,stacks,studs,Off-shoulder,delicate
Pear-shaped,optional,kurti,mid length,rounded,charms,drop earrings,Fitted,Small and elegant
Inverted triangle,optional,kurti,short length,choker,charms,studs,High neckline with a V-neck ending at the waist,Golden bracelet
Rectangle,broad shoulders,kurti,full length,choker,bangles,studs,Fitted,Fitted
Pear-shaped,busted,party wear,short length,choker,stacks,studs,Halter neck,Small choker with matching earrings and stacked bracelets
Hourglass,optional,t shirt,full length,rounded,stacks,drop earrings,slim fit knee length dress with ruffles,yellow floral patterns with gold accents
Apple-shaped,optional,party wear,short length,rounded,bangles,studs,Fitted top with a round neckline and short sleeves,"Earrings and bracelet are very simple, so you can use a necklace with a pendant"
Hourglass,broad shoulders,party wear,short length,choker,charms,drop earrings,This dress design is suitable for the hourglass body type and party wear dress type. The short sleeve length would add a touch of elegance to the overall look.,"This accessory design is suitable for the given necklace, bracelet, and earrings. Additionally, the choker necklace, charms bracelet, and drop earrings add an elegant touch to the overall look."
Pear-shaped,broad shoulders,party wear,sleeveless,choker,bangles,drop earrings,Body-hugging,Statement earrings with drop earrings
Rectangle,optional,party wear,full length,rounded,bangles,drop earrings,front slit,"necklace and bracelet are kept simple, and earrings are kept big"
Pear-shaped,optional,party wear,short length,choker,charms,studs,A-line dress,"Earrings: studs, bracelet: charms, necklace: choker"
Rectangle,optional,party wear,mid length,choker,stacks,studs,strapless dress,string
Pear-shaped,optional,t shirt,puffy shoulder,v shape,charms,drop earrings,Straight,v shape
Pear-shaped,optional,crop top,short length,rounded,bangles,jhumka,with plunging neckline,plain
Rectangle,optional,party wear,one shouldered,choker,stacks,studs,Sexy party gown,"Necklace: choker, bracelet: stacks, earrings: studs - The accessory design that goes well with this combination is a set of stud earrings, a choker necklace, and stacked bracelets."
Hourglass,busted,t shirt,full length,rounded,stacks,drop earrings,It is a good choice for the body type,"It is a good choice for the given necklace, bracelet, and earrings"
Pear-shaped,broad shoulders,crop top,sleeveless,rounded,charms,drop earrings,long sleeve top,a simple necklace
Apple-shaped,busted,kurti,short length,v shape,bangles,jhumka,Wear a long kurti with short sleeve and flared bottom,Assymetrical Necklace with matching earrings and bangle
Apple-shaped,optional,party wear,full length,choker,stacks,studs,Dress with long sleeves and a high neckline.,"Go for a classic look with choker, stacks, and studs"
Hourglass,busted,party wear,short length,choker,bangles,jhumka,Knee Length Fit & Flare Dress,Boho
Hourglass,busted,party wear,full length,choker,stacks,drop earrings,V-neck,simple and classy
